"id","pubyear","title"
"WOS:000343194100007","2014","The BIM deletion polymorphism cannot account for intrinsic TKI resistance of Chinese individuals with chronic myeloid leukemia"
"WOS:000339444700023","2014","Implementation of BIM in the Danish Building Sector"
"WOS:000363251200008","2014","Fostering the Link from PLM to ERP via BIM The AEC Industry in Transition"
"WOS:000354774500048","2014","Experimental BIM Applications in Archaeology: A Work-Flow"
"WOS:000337114400292","2014","The Obstructions that hamper the use of BIM in China and its solutions"
"WOS:000339031501225","2014","Development of BIM Technology in Steel Structure Design Software"
"WOS:000351057000166","2014","Investigation and Application of BIM for Building Costs of Project Management"
"WOS:000343806604010","2014","Succeeding with Building Information Modeling: A Case Study of BIM Diffusion in a Healthcare Construction Project"
"WOS:000345314100020","2014","A Cooperative System of GIS and BIM for Traffic Planning: A High-Rise Building Case Study"
"WOS:000338974900169","2014","Applied Research of BIM Technology on Prestressed Steel Structures in Xuzhou Stadium"
"WOS:000346224500003","2014","Processing of Topological BIM Queries using Boundary Representation Based Methods"
"WOS:000329832900005","2014","Lessons learnt from customization of a BIM tool for a design-build company"
"WOS:000210032400016","2014","A REVIEW OF CLOUD-BASED BIM TECHNOLOGY IN THE CONSTRUCTION SECTOR"
"WOS:000352706200045","2014","Research on 3DGIS and BIM Integrated Application in Smart City Construction"
"WOS:000341639300045","2014","Evidence against upstream regulation of the unfolded protein response (UPR) by pro-apoptotic BIM and PUMA"
"WOS:000338814900010","2014","Beyond the BIM utopia: Approaches to the development and implementation of building information modeling"
"WOS:000348897600281","2014","The Analysis of Resistances that Hamper the Use of BIM in China"
"WOS:000346413500022","2014","Quantitative Measurement of BIM Protein in Lung Cancer"
"WOS:000361384700061","2014","B(H) IM - Built Heritage Information Modelling Extending BIM approach to historical and archaeological heritage representation"
"WOS:000359481600107","2014","BH3-Only Molecule BIM Mediates beta-Cell Death in IRS2 Deficiency"
"WOS:000347745800010","2014","CoSMoS: A BIM and wireless sensor based integrated solution for worker safety in confined spaces"
"WOS:000358613204135","2014","Effect of BIM and mTOR expression on clinical outcome to erlotinib in EGFR-mutant non-small cell lung cancer (NSCLC) patients (p)"
"WOS:000335309100088","2014","Identification of cis-Acting Elements and Splicing Factors Involved in the Regulation of BIM Pre-mRNA Splicing"
"WOS:000355260500177","2014","The Research and Application of BIM Technology inOverseas EPC Project"
"WOS:000343194100008","2014","The BIM deletion polymorphism cannot account for intrinsic TKI resistance of Chinese individuals with chronic myeloid leukemia Reply"
"WOS:000331491500010","2014","Diffusion of BIM & Confusion in Architecture Industry"
"WOS:000380551400033","2014","A SURVEY ON THE VISUAL COMMUNICATION SKILLS OF BIM TOOLS"
"WOS:000344430900007","2014","Merging BIM and GIS using ontologies application to urban facility management in ACTIVe3D"
"WOS:000366974900001","2015","Identification and functional analysis of the BIM interactome; new clues on its possible involvement in Epstein-Barr Virus-associated diseases"
"WOS:000380490000024","2015","A visual BIM query language"
"WOS:000360072500073","2015","Leveraging BIM Interoperability for UWB-Based WSN Planning"
"WOS:000346341900008","2015","BIM2MAR: An Efficient BIM Translation to Mobile Augmented Reality Applications"
"WOS:000380490000023","2015","An approach to enhancing the connection between BIM models and building energy simulation - HVAC systems in the loop"
"WOS:000361578000007","2015","Measuring the impact of BIM on labor productivity in a small specialty contracting enterprise through action-research"
"WOS:000215245400009","2015","Evaluating the Alignment of Organizational and Project Contexts for BIM Adoption: A Case Study of a Large Owner Organization"
"WOS:000352158000014","2015","Functional antagonism between pro-apoptotic BIM and anti-apoptotic BCL-XL in MYC-induced lymphomagenesis"
"WOS:000370957800062","2015","Study on BIM utilization for design improvement of infrastructure project"
"WOS:000358984800009","2015","MODEL STUDY OF DESIGN COMPONENTS FOR ENERGY-PERFORMANCE-BASED ARCHITECTURAL DESIGN USING BIM LOD 100"
"WOS:000361578000004","2015","Real time progress management: Re-engineering processes for cloud-based BIM in construction"
"WOS:000380488800030","2015","Prospects for the use of BIM in Poland and the Czech Republic - Preliminary research results"
"WOS:000344713800007","2015","Custom-Designed Structures and Facades with Parametric-Algorithmic BIM Systems: 1 Bligh Street, Green Star Rated High Rise Project, Sydney"
"WOS:000380490000017","2015","A graph-based prediction method for electrical wiring in old residential buildings as a part of BIM for Urban Mining purposes"
"WOS:000360772400021","2015","Connecting building component catalogues with BIM models using semantic technologies: an application for precast concrete components"
"WOS:000380490000007","2015","Development of baseline processes for sustainable and BIM building projects"
"WOS:000359820900094","2015","Loss of the pro-apoptotic BH3-only protein BIM results in increased beta cell mass in a mouse model of type 2 diabetes"
"WOS:000353848400005","2015","Appearance-based material classification for monitoring of operation-level construction progress using 4D BIM and site photologs"
"WOS:000380549300050","2015","CHALLENGE OF TEACHING BIM IN THE FIRST YEAR OF UNIVERSITY"
"WOS:000366119600026","2015","A novel prohibitin-binding compound induces the mitochondrial apoptotic pathway through NOXA and BIM upregulation"
"WOS:000358036902855","2015","Association of high BIM mRNA levels with longer survival in advanced gastric cancer."
"WOS:000359315800005","2015","Cloud-to-BIM-to-FEM: Structural simulation with accurate historic BIM from laser scans"
"WOS:000353848400001","2015","Extending BIM interoperability to preconstruction operations using geospatial analyses and semantic web services"
"WOS:000356732100011","2015","How Far Can BIM Reduce Information Asymmetry in the Australian Construction Context?"
"WOS:000371578506082","2015","MEK/ERK inhibitor GDC-0623 dephosphorylates and accumulates BIM that enables a synergistic apoptosis with the Bcl-xL antagonist, ABT-263, in mutant KRAS colorectal cancer cells"
"WOS:000361212600013","2015","A BIM BASED APPROACH FOR CONFIGURING BUILDINGS' OUTER ENVELOPE ENERGY SAVING ELEMENTS"
"WOS:000359445400008","2015","Contextualizing learning approaches which shape BIM for maintenance"
"WOS:000356107200001","2015","Automatic BIM component extraction from point clouds of existing buildings for sustainability applications"
"WOS:000366769500022","2015","An approach to combine progressively captured point clouds for BIM update"
"WOS:000380549300044","2015","A BIM TOOL FOR CARBON FOOTPRINT ASSESSMENT OF BUILDING DESIGN"
"WOS:000376283500010","2015","Construction management and design of infrastructure. BIM and CIM. New approaches and new opportunity for the engineer of tomorrow"
"WOS:000353376800111","2015","High Prevalence of the BIM Deletion Polymorphism in Young Female Breast Cancer in an East Asian Country"
"WOS:000380430700094","2015","Sustainable Design with BIM Facilitation in Project-based Learning"
"WOS:000363088800016","2015","Demystifying Construction Project Time-Effort Distribution Curves: BIM and Non-BIM Comparison"
"WOS:000350059500009","2015","Ontological inference of work item based on BIM data"
"WOS:000380490000018","2015","From BIM to life cycle information management in infrastructure"
"WOS:000358684200040","2015","The application of BIM technology in the construction of Hangzhou Zizhi tunnel"
"WOS:000411355200042","2015","Virtual BIM Testbeds The eRobotics Approach to BIM and Its Integration Into Simulation, Rendering, Virtual Reality and More"
"WOS:000364242300091","2015","Development of Kinematic 3D Laser Scanning System for Indoor Mapping and As-Built BIM Using Constrained SLAM"
"WOS:000346341900003","2015","Sociotechnical Systems Approach to BIM Implementation in a Multidisciplinary Construction Context"
"WOS:000375561900127","2015","The Application Research of BIM Technology in Energy Efficiency Evaluation About High-rise Building"
"WOS:000368021802063","2015","Cathepsin-Cleavable BIM BH3 Peptide Amphiphiles Are Potent Inducers of Cellular Apoptosis"
"WOS:000402646500056","2015","Barriers for BIM (Building Information Modeling) Adoption"
"WOS:000381088400026","2015","Research on Precast Concrete Structures with BIM Involving Information on Structural Details and Behaviors"
"WOS:000363644300001","2015","Case Study of Carbon Emissions from a Building's Life Cycle Based on BIM and Ecotect (Retracted article. See art no 2193505, 2017)"
"WOS:000380549300039","2015","DEVELOPMENT OF BUILDING INFORMATION MANAGEMENT SYSTEM USING BIM TOWARD STRATEGIC BUILDING OPERATION AND MAINTENANCE"
"WOS:000356639100003","2015","Project Management with BIM Add-on"
"WOS:000352378800013","2015","The Introduction of the BIM Concept in Civil Engineering Curriculum"
"WOS:000381088400020","2015","Green Building Materials Management Based on BIM Technology"
"WOS:000380437800042","2015","Coordination between Understanding Historic Buildings and BIM Modelling: A 3D-Output Oriented and typological Data Capture Method"
"WOS:000371578500007","2015","Quantitative assessment of BCL-2: BIM complexes as a pharmacodynamic marker for venetoclax (ABT-199)"
"WOS:000346986500009","2015","Lack of Association between the BIM Deletion Polymorphism and the Risk of Lung Cancer with and without EGFR Mutations"
"WOS:000358455300130","2015","Glucocorticoid-mediated co-regulation of RCAN1-1, E4BP4 and BIM in human leukemia cells susceptible to apoptosis"
"WOS:000372317300063","2015","Masonry Regions: A New Approach for the Representation of Masonry Walls in BIM Applications"
"WOS:000363185500068","2015","Knockout Serum Replacement Promotes Cell Survival by Preventing BIM from Inducing Mitochondrial Cytochrome C Release"
"WOS:000218623100009","2015","EFFECTS OF PERCEPTIONS ON BIM ADOPTION IN MALAYSIAN CONSTRUCTION INDUSTRY"
"WOS:000219180800004","2015","Legal risks incurred under the application of BIM in Taiwan"
"WOS:000380499900140","2015","Features of BIM Implementation Using Autodesk Software"
"WOS:000361212600004","2015","THE ASSESSMENT OF CONSTRUCTABILITY: BIM CASES"
"WOS:000348656200007","2015","Use of BIM approach to enhance construction interface management: a case study"
"WOS:000380490000025","2015","A comparison study on BIM and unconstructed knowledge at idea generation phase"
"WOS:000369434200008","2015","Key factors for the BIM adoption by architects: a China study"
"WOS:000370365101098","2015","HDAC Inhibitors Overcome New Generation EGFR-TKI-Resistance Caused by Homozygous BIM Polymorphism in EGFR Mutant Lung Cancer"
"WOS:000388705200006","2015","MOVE ON TO BIM 10 rules to be successful"
"WOS:000350810200016","2015","Opposing regulation of BIM and BCL2 controls glucocorticoid-induced apoptosis of pediatric acute lymphoblastic leukemia cells"
"WOS:000359444700001","2015","A survey of current status of and perceived changes required for BIM adoption in the UK"
"WOS:000380549300040","2015","DIGITAL DOCUMENTATION INTEGRATED IN BIM FOR BUILDING REUSE AND SUSTAINABLE RETROFIT"
"WOS:000372317300065","2015","The Position of BIM Tools in Conceptual Design Phase: Parametric Design and Energy Modeling Capabilities"
"WOS:000356502700001","2015","The effect of BIM deletion polymorphism on intrinsic resistance and clinical outcome of cancer patient with kinase inhibitor therapy"
"WOS:000372317300061","2015","BIM for Masonry: Development of BIM Plugins for the Masonry Unit Database"
"WOS:000371514300057","2015","Application of BIM in the protection of historical buildings based on Riegel historic value theory"
"WOS:000356639100013","2015","To Plan with BIM Structures"
"WOS:000380490000009","2015","The assessment of constructability: BIM cases"
"WOS:000380434300348","2015","AHP Based Weighting System for BIM Implementation & Assessment Framework"
"WOS:000355649800002","2015","Needs and technology adoption: observation from BIM experience"
"WOS:000380430700106","2015","Performance Evaluation of Automatically Generated BIM from Laser Scanner Data for Sustainability Analyses"
"WOS:000393320200190","2015","Research on the application of BIM Model in Interior Design"
"WOS:000380549300090","2015","A FUNDAMENTAL STUDY ON BIM BENEFITS MEASUREMENT SYSTEM FOR ARCHITECTURAL DESIGN FIRM"
"WOS:000358679700054","2015","Collaboration with BIM - Learning from the front runners in the Norwegian industry"
"WOS:000380549300099","2015","DEVELOPMENT OF IMMERSIVE SIMULATOR FOR VISUALIZATION OF BIM DATA"
"WOS:000372316000016","2015","Integrating BIM in Education: Lessons Learned"
"WOS:000377254000018","2015","A Framework for Speech-Oriented CAD and BIM Systems"
"WOS:000380955400002","2015","Information Exchange Standardization for BIM Application to Multi-Story Modular Residential Buildings"
"WOS:000356107200002","2015","A query expansion method for retrieving online BIM resources based on Industry Foundation Classes"
"WOS:000366838600002","2015","Creation of Parametric BIM Objects from Point Clouds Using Nurbs"
"WOS:000359818900393","2015","Research on the Application of Building Information Model Based on BIM Technology"
"WOS:000372317300008","2015","BIM Interactive - About Combining BIM and Virtual Reality A Bidirectional Interaction Method for BIM Models in Different Environments"
"WOS:000361212600020","2015","BIM FOR FACILITIES MANAGEMENT: EVALUATING BIM STANDARDS IN ASSET REGISTER CREATION AND SERVICE LIFE PLANNING"
"WOS:000375561900033","2015","The Analysis of the Possibility of Applying BIM in Green Architectural Design"
"WOS:000381013000007","2015","WebVis_BIM: Real Time Web3D Visualization of Big BIM Data"
"WOS:000363160100088","2015","The BIM deletion polymorphism is a prognostic biomarker of EGFR-TKIs response in NSCLC: A systematic review and meta-analysis"
"WOS:000380549300100","2015","THE LOD AND BUILDING OBJECT CLASSIFICATION FOR THE COMPONENTS OF NEO-HANOK BIM MODEL"
"WOS:000368019001221","2015","Germline Genetic Variation of ASXL1 and BIM Predicts Response to Imatinib and Identifies a Subset of High Sokal Risk Patients with the Greatest Risk of Treatment Failure and Disease Progression"
"WOS:000371425800076","2015","Visualization of HVAC pipeline integrated arrangement based on BIM technology"
"WOS:000380490000006","2015","Goal-driven method for sustainable evaluation of BIM project success level"
"WOS:000377814500004","2015","Using BIM to integrate and achieve holistic future-proofing objectives in healthcare projects"
"WOS:000362070800016","2015","The BIM Deletion Polymorphism and its Clinical Implication in Patients with EGFR-Mutant Non-Small-Cell Lung Cancer Treated with EGFR Tyrosine Kinase Inhibitors"
"WOS:000380508800212","2015","A Dutch Concept Library (CB-NL) to support BIM for the life cycle"
"WOS:000360772400002","2015","PassivBIM: Enhancing interoperability between BIM and low energy design software"
"WOS:000372317300064","2015","A BIM Platform for Offsite Timber Construction"
"WOS:000380437800005","2015","INTEGRATION OF JEDDAH HISTORICAL BIM AND 3D GIS FOR DOCUMENTATION AND RESTORATION OF HISTORICAL MONUMENT"
"WOS:000357228900018","2015","Bridging BIM and building: From a literature review to an integrated conceptual framework"
"WOS:000352727000030","2015","VALIDATION OF BIM COMPONENTS BY PHOTOGRAMMETRIC POINT CLOUDS FOR CONSTRUCTION SITE MONITORING"
"WOS:000369841500021","2015","Towards a Workflow-Driven Multi-model BIM Collaboration Platform"
"WOS:000367769800017","2015","Waste minimisation through deconstruction: A BIM based Deconstructability Assessment Score (BIM-DAS)"
"WOS:000358036904447","2015","BIM deletion polymorphism is not associated with BIM RNA expression or BIM immunohistochemistry intensity in epidermal growth factor receptor mutationpositive nonsmall cell lung cancer."
"WOS:000352709000004","2015","A case study of time/cost analysis for aged-housing renovation using a pre-made BIM database structure"
"WOS:000380488800054","2015","Reflection on BIM development practices at the pre-maturity"
"WOS:000371807800526","2015","A Study on the Application of BIM in Civil Engineering Professional Practice"
"WOS:000370365102583","2015","The BIM Deletion Polymorphism in Patients with EGFR-Mutant Non-Small Cell Lung Cancer Treated with EGFR Tyrosine Kinase Inhibitors"
"WOS:000214595700005","2015","Literature review of green retrofit design for commercial buildings with BIM implication"
"WOS:000380495100053","2015","Functional assessment of BIM methodology based on implementation in design and construction company"
"WOS:000380499900007","2015","Challenges of BIM for Construction Site Operations"
"WOS:000373135700022","2015","EXPERIMENTATION OF THE BIM TECHNIQUE ON ROMAN ARCHAEOLOGY: THE CASE OF THE STRUCTURES REDISCOVERED INSIDE THE CRYPT OF SS. SERGIUS AND BACCUS IN ROME"
"WOS:000380548200034","2015","DATA QUALITY ELEMENTS FOR BIM APPLIED TO HERITAGE MONUMENTS"
"WOS:000360100600090","2015","PROTEASOME-MEDIATED DEGRADATION OF PRO-APOPTOTIC MOLECULE BIM RENDERS CD4+CD28(NULL) T CELLS RESISTANT TO APOPTOSIS IN MYOCARDIAL INFARCTION"
"WOS:000368440600048","2015","A NEW IDEA OF BIM SYSTEM FOR VISUALIZATION, WEB SHARING AND USING HUGE COMPLEX 3D MODELS FOR FACILITY MANAGEMENT."
"WOS:000349123700002","2015","A Study on the BIM Application of Green Building Certification System"
"WOS:000360311800007","2015","Integrating BIM and LiDAR for Real-Time Construction Quality Control"
"WOS:000358679700047","2015","A BIM collaboration lab for improved through life support"
"WOS:000348580600006","2015","Closing the gap in building performance: learning from BIM benchmark industries"
"WOS:000359445400002","2015","Case-based reasoning and BIM systems for asset management"
"WOS:000358679700058","2015","Challenges of implementing new technologies in the world of BIM - Case study from construction engineering industry in Finland"
"WOS:000380405100167","2015","A Study on the Status of Infrastructure BIM and BIM Library Development"
"WOS:000392737000227","2015","The Role of BIM in Teaching Structural Design"
"WOS:000384838700006","2015","A REVIEW OF THE EFFORTS AND ROLES OF THE PUBLIC SECTOR FOR BIM ADOPTION WORLDWIDE"
"WOS:000370365103150","2015","Paxillin Confers Resistance to TKI via Modulating BIM and Mcl-1 Protein Stability"
"WOS:000358003700016","2015","Increased lymphocyte apoptosis in mouse models of colitis upon ABT-737 treatment is dependent upon BIM expression"
"WOS:000357935800030","2015","Association between BIM deletion polymorphism and clinical outcome of EGFR-mutated NSCLC patient with EGFR-TKI therapy: A meta-analysis"
"WOS:000364335400007","2015","Hospitalhof Stuttgart - about three-dimensional structures, BIM and the chance for a paradigm shift"
"WOS:000361816500030","2015","The Mutant KRAS Gene Up-regulates BCL-XL Protein via STAT3 to Confer Apoptosis Resistance That Is Reversed by BIM Protein Induction and BCL-XL Antagonism"
"WOS:000380620800028","2015","POINT CLOUDS SEGMENTATION AS BASE FOR AS-BUILT BIM CREATION"
"WOS:000347578900005","2015","Mapping actual thermal properties to building elements in gbXML-based BIM for reliable building energy performance modeling"
"WOS:000380549300043","2015","PARAMETRIC BIM WORKFLOWS"
"WOS:000372317300072","2015","Integration of CFD, VR, AR and BIM for Design Feedback in a Design Process An Experimental Study"
"WOS:000380490000076","2015","The utilisation of BIM as a project management tool"
"WOS:000347578900006","2015","A framework for dimensional and surface quality assessment of precast concrete elements using BIM and 3D laser scanning"
"WOS:000361204903083","2015","NILOTINIB IN JAPANESE PATIENTS WITH CHRONIC MYELOID LEUKEMIA (CML) WITH SUBOPTIMAL MOLECULAR RESPONSE (MR) TO FRONTLINE IMATINIB: SENSOR FINAL 24-MO ANALYSIS AND BIM POLYMORPHISMS SUBSTUDY"
"WOS:000358788800004","2015","Conversion of cell-survival activity of Akt into apoptotic death of cancer cells by two mutations on the BIM BH3 domain"
"WOS:000362305400001","2015","Effective digital collaboration in the construction industry - A case study of BIM deployment in a hospital construction project"
"WOS:000359936900004","2015","Investigating the Role of Lean Practices in Enabling BIM Adoption: Evidence from Two Indian Cases"
"WOS:000380490000011","2015","A BIM model to visualize quality risks in construction projects"
"WOS:000349580400002","2015","Developing a physical BIM library for building thermal energy simulation"
"WOS:000380560500025","2015","Practical implementation of semi-automated as-built BIM creation for complex indoor environments"
"WOS:000361212600014","2015","MAPPING BIM SCHEMA AND 3D GIS SCHEMA SEMI-AUTOMATICALLY UTILIZING LINGUISTIC AND TEXT MINING TECHNIQUES"
"WOS:000380430700105","2015","Sustainable Design of Buildings using Semantic BIM and Semantic Web Services"
"WOS:000353848400007","2015","Classification of rules for automated BIM rule checking development"
"WOS:000358170400043","2015","Different effects of the BIM deletion polymorphism on treatment of solid tumors by the tyrosine kinase inhibitors (TKI) pazopanib, sunitinib, and lapatinib"
"WOS:000380380800036","2015","Profile of Building Information Modeling - BIM - Tools Maturity in Brazilian Civil Construction Scenery"
"WOS:000383740301102","2015","Green BIM in sustainable infrastructure"
"WOS:000380955400057","2015","A Curriculum Approach to Deploying BIM in Architectural Engineering"
"WOS:000360311800013","2015","Implementation of a BIM Domain-specific Language for the Building Environment Rule and Analysis"
"WOS:000358612700001","2015","Using BIM to Improve the Design and Construction of Bridge Projects: A Case Study of a Long-span Steel-box Arch Bridge Project (Retraction of vol 11, 125, 2014)"
"WOS:000421763800014","2015","The relationship between BIM deletion polymorphism and clinical significance of epidermal growth factor receptor-mutated non-small cell lung cancer patients with epidermal growth factor receptor-tyrosine kinase inhibitor therapy: a meta-analysis"
"WOS:000381088400025","2015","Collaborative Construction Schedule and Management Based on BIM Theory"
"WOS:000377254000019","2015","Development of BIM Performance Measurement System for Architectural Design Firms"
"WOS:000410241200013","2015","THE USE OF BIM TECHNOLOGY IN ARCHITECTURAL DESIGN SCHOOL BUILDINGS AND CONSTRUCTIONS"
"WOS:000361867200022","2015","Cellular Uptake and Ultrastructural Localization Underlie the Proapoptotic Activity of a Hydrocarbon-stapled BIM BH3 Peptide"
"WOS:000380692500037","2015","The Role of BIM Technology in the Risk Control and Marketing of Real Estate Projects"
"WOS:000372317300062","2015","Project Risk Modelling Information and Management Framework How to enhance risk management framework improve actor mutual understanding using BIM and Augmented reality tools"
"WOS:000380380800037","2015","Potential of Building Information Modeling - BIM - Tools Inside Brazilian Civil Construction Scenery"
"WOS:000375708200077","2015","Research on the Technology Integration of Building Industrialization Based on BIM Technology"
"WOS:000381088400014","2015","Research on Housing Component Searching Based on BIM and E-Business"
"WOS:000380490000001","2015","Introducing BIM plus : An open platform for building faster and better"
"WOS:000414633600014","2015","Study of Applying API on Evacuation Route Assessing in BIM Modeling"
"WOS:000380581900002","2015","Application of BIM in construction engineering information integration and management"
"WOS:000351205400003","2015","Multi-Scale Geometric-Semantic Modeling of Shield Tunnels for GIS and BIM Applications"
"WOS:000409709000003","2015","Innovation Performance Study on the Construction Safety of Urban Subway Engineering Based on Bayesian Network: A Case Study of BIM Innovation Project"
"WOS:000416480500003","2016","BUILDING INFORMATION MODELLING: ESSENTIALS AND ISSUES The Need to Integrate BIM and Geoinformation"
"WOS:000385791200024","2016","Current state of information exchange between the two most popular BIM software: Revit and Tekla"
"WOS:000387531600143","2016","Exploring the Adoption of BIM in the UAE construction industry for AEC firms"
"WOS:000374468600005","2016","Assessment of BIM acceptance degree of Korean AEC participants"
"WOS:000389279901019","2016","Integrating BIM and Project Schedule Information Using Semantic Web Technology"
"WOS:000368062000014","2016","The BH3-only protein BIM contributes to late-stage involution in the mouse mammary gland"
"WOS:000388287600295","2016","Exploration of BIM Technology Diffusion organizational model based on the transaction cost theory"
"WOS:000375818300001","2016","Mapping between BIM and 3D GIS in different levels of detail using schema mediation and instance comparison"
"WOS:000369951800024","2016","Suppression of BRD4 inhibits human hepatocellular carcinoma by repressing MYC and enhancing BIM expression"
"WOS:000387109100303","2016","Survival significance of BIM in cervical cancer"
"WOS:000416481200008","2016","FARO Launches Laser Scanner for BIM Projects"
"WOS:000388365500091","2016","Research on Breadth and Depth of BIM capabilities"
"WOS:000378549400017","2016","3D Capture Techniques for BIM Enabled LCM"
"WOS:000412056500081","2016","3D Substation Modeling Based on BIM Technology in China"
