"id","pubyear","title"
"WOS:000337164500077","2012","Infrastructural BIM standards - Development of an Information Delivery Manual for the geotechnical infrastructural design and analysis process"
"WOS:000312234601058","2012","Research on the Application of BIM in the Operation Stage of Green Building"
"WOS:000209701604360","2012","Identification of cis-regulatory elements in a BIM deletion polymorphism that regulate splicing and generation of non-apoptotic BIM isoforms"
"WOS:000314049601321","2012","Fingolimod (FTY720) Overcomes the Resistance to Tyrosine Kinase Inhibitors Via Dual Activation of BIM and BID in Chronic Myelogenous Leukemia"
"WOS:000309496200050","2012","Collision Detection of Building Facility Pipes and Ducts Based on BIM Technology"
"WOS:000310713200006","2012","The BIM Process"
"WOS:000213072200004","2012","Measuring BIM performance: Five metrics"
"WOS:000351498300054","2012","PARAMETRIC AND GENERATIVE METHODS WITH BUILDING INFORMATION MODELLING Connecting BIM with explorative design modelling"
"WOS:000209701500065","2012","A common BIM polymorphism mediates intrinsic resistance and inferior responses to tyrosine kinase inhibitors in cancer"
"WOS:000214202800007","2012","Aligning BIM with FM: streamlining the process for future projects"
"WOS:000336106300255","2013","The Application of BIM in Updating the Thermal Environment Design of Traditional Residences in Mountain Region- A Case of Chongqing"
"WOS:000339624902159","2013","THE BIM DELETION POLYMORPHISM PROFILE AND ITS RELATIONSHIP WITH TKIS RESISTANCE IN CHINESE NSCLC POPULATION"
"WOS:000316515500003","2013","Development of Building Fire Control and Management System in BIM Environment"
"WOS:000210030700008","2013","A STUDY OF BIM COLLABORATION REQUIREMENTS AND AVAILABLE FEATURES IN EXISTING MODEL COLLABORATION SYSTEMS"
"WOS:000315933100023","2013","Integrating BIM and GIS to improve the visual monitoring of construction supply chain management"
"WOS:000335419600466","2013","Clinical significance of BIM deletion polymorphism in non-small cell lung cancer with epidermal growth factor receptor mutation."
"WOS:000352079100035","2013","Construction health and safety, BIM and cloud technology"
"WOS:000351496100075","2013","INDUSTRY-WIDE ADOPTION THROUGH A COMPREHENSIVE BUILDING INFORMATION MODELLING (BIM) ROADMAP AND BIM ELECTRONIC REGULATORY SUBMISSION Leadership of Singapore Government"
"WOS:000331272900162","2013","THE EFFECT OF BIM SILENCING BY SIRNA ON APOPTOSIS INDUCED BY HYPOXIA IN RAT CARDIOMYOCYTE"
"WOS:000331220604066","2013","Poor predictive power of BIM deletion polymorphism for EGFR tyrosine kinase inhibitor outcome in non-small cell lung cancer patients harboring EGFR mutation."
"WOS:000349674600127","2013","INTEGRATED BIM MANAGEMENT SYSTEM AND ITS APPLICATION ON CIVIL ENGINEERING SITES"
"WOS:000339624901194","2013","ANALYSIS OF BIM DELETION POLYMORPHISM IN CHINESE PATIENTS WITH NSCLC"
"WOS:000340643600054","2013","Daylight Performance Simulations and 3D Modeling in BIM and non-BIM Tools Interoperability and accuracy - an experience aiming to a more integrated and interdisciplinary approach"
"WOS:000219891000017","2013","Information Modeling in Creative Process. Innovative possibility of BIM in architectural and urban processes"
"WOS:000363258100062","2013","Incomplete BIM Implementation: Exploring Challenges and the Role of Product Lifecycle Management Functions"
"WOS:000346374300106","2013","Standardisation of the design process using BIM software"
"WOS:000333803900335","2013","The Application of BIM in the Completion Phase"
"WOS:000323185101266","2013","Analysis and Application of BIM Technology in the Project Goal Control"
"WOS:000336106800343","2013","Bibliometric Analysis on BIM Research in China"
"WOS:000325742500001","2013","Requirements for BIM platforms in the concrete reinforcement supply chain"
"WOS:000339463301318","2013","Research on BIM technology application in the construction of a subway station"
"WOS:000324486500006","2013","Epigenetic Silencing of the Proapoptotic Gene BIM in Anaplastic Large Cell Lymphoma through an MeCP2/SIN3a Deacetylating Complex"
"WOS:000329679801186","2013","Application of BIM on Quantity Estimate for Reinforced Concrete"
"WOS:000317630700292","2013","Explore On Digital Restoration Of Historic Buildings In Colleges Based On The BIM Concept-As The Example Of Jilin Architecture And Civil Engineering Institute Hong Qi Campus"
"WOS:000312233700015","2013","A knowledge-based BIM system for building maintenance"
"WOS:000359802100164","2013","The BIM in Green Architectural Design Software Investigation"
"WOS:000337970800123","2013","Study on Collaborative Design of Green Building Based on BIM Technology"
"WOS:000209487800038","2013","Sensitizing low BIM expressing breast cancers to targeted therapies"
"WOS:000352079100016","2013","Cloud and Computer Mediated Collaboration in the Early Architectural Design Stages A study of early design stage collaboration related to BIM and the Cloud"
"WOS:000336106800339","2013","Quality and Maturity of BIM Implementation in the AECO Industry"
"WOS:000339411600386","2013","Construction Information Management Based on BIM Technology"
"WOS:000339624903325","2013","IMPACT OF EGFR T790M MUTATIONS AND BIM MRNA EXPRESSION ON PROGRESSION-FREE SURVIVAL (PFS) AND OVERALL SURVIVAL (OS) IN PATIENTS WITH EGFR-MUTANT NON-SMALL-CELL LUNG CANCER (NSCLC) TREATED WITH ERLOTINIB OR CHEMOTHERAPY IN THE RANDOMIZED PHASE III EURTAC TRIAL"
"WOS:000350208600259","2013","Combining shape grammars and BIM in the rehabilitation design process of the bourgeois house of Oporto: the research progress"
"WOS:000325742500014","2013","An integrated approach to BIM competency assessment, acquisition and application"
"WOS:000346374300097","2013","Multidisciplinary team activity using BIM and interoperability. A PhD course experience at Politecnico di Torino."
"WOS:000326279900076","2013","Beyond BIM - A Classroom Approach To Virtual Design Education"
"WOS:000375256304001","2013","Strategy to incorporate BIM curriculum in Planning and Scheduling classes"
"WOS:000327937000012","2013","Study on BIM Technology Teaching Under The Background of Three-dimensional Design"
"WOS:000317595800007","2013","EGFR-TKI Resistance Due to BIM Polymorphism Can Be Circumvented in Combination with HDAC Inhibition"
"WOS:000316795100005","2013","PUMA and BIM Are Required for Oncogene Inactivation-Induced Apoptosis"
"WOS:000329679801137","2013","Construction Project Cost Management Based on BIM Technology"
"WOS:000351496100003","2013","A THOUSAND BIM A rapid value-simulation approach to developing a BIM tool for supporting collaboration during schematic design"
"WOS:000360584300005","2013","ASSESSMENT OF INFORMATION MATURITY DURING DESIGN, OPERATION AND MAINTENANCE STAGES WITHIN BIM USE ENVIRONMENT"
"WOS:000326982300086","2013","Facilitating Meaningful Collaboration in Architectural Design through the adoption of BIM (Building Information Modelling)"
"WOS:000375255607028","2013","Energy modeling/Simulation Using the BIM technology in the Curriculum of Architectural and Construction Engineering and Management"
"WOS:000315933100022","2013","Automatic thermographic and RGB texture of as-built BIM for energy rehabilitation purposes"
"WOS:000335419600599","2013","R497K of EGFR and BIM deletion polymorphisms as predictive biomarkers to EGFR TKIs in NSCLCs harboring wild-type EGFR."
"WOS:000339624901195","2013","THE PREDICTIVE ROLE OF COMMON BIM DELETION POLYMORPHISM AND BIM EXPRESSION ON THE EGFR-TKI THERAPY IN NEVER-SMOKING LUNG ADENOCARCINOMA"
"WOS:000339411600238","2013","A New Design Concept by Using BIM for Reforming an Energy-saving Campus Building"
"WOS:000327809000010","2013","The Germline BIM Deletion Polymorphism Is Not Associated with the Treatment Efficacy of Sorafenib in Patients with Advanced Hepatocellular Carcinoma"
"WOS:000312233700002","2013","LicA: A BIM based automated code-checking application for water distribution systems"
"WOS:000339411600387","2013","Informationize of College Infrastructure Project Management Base on BIM Technology"
"WOS:000314446100016","2013","Protein kinase C inhibitor BIM suspended TRPV1 effect on mu-opioid receptor"
"WOS:000315879400004","2013","Gefitinib-Resistance Is Related to BIM Expression in Non-Small Cell Lung Cancer Cell Lines"
"WOS:000315397900087","2013","Downregulation of miR-17 similar to 92 Expression Increase Paclitaxel Sensitivity in Human Ovarian Carcinoma SKOV3-TR30 Cells via BIM Instead of PTEN"
"WOS:000316042300001","2013","HEROIN ACTIVATES BIM VIA C-JUN N-TERMINAL KINASE/C-JUN PATHWAY TO MEDIATE NEURONAL APOPTOSIS"
"WOS:000358415700006","2013","INTEGRATING AND MANAGING BIM IN GIS, SOFTWARE REVIEW"
"WOS:000328272900009","2013","Isolation and structural identification of glycopolymers of Bifidobacterium bifidum BIM B-733D as putative players in pathogenesis of autoimmune thyroid diseases"
"WOS:000339411600364","2013","Application of BIM in Construction and Analysis of Obstacles"
"WOS:000329441900017","2013","ADOPTION PROCESSES FOR EDM, EDI AND BIM TECHNOLOGIES IN THE CONSTRUCTION INDUSTRY"
"WOS:000329679801238","2013","Study on Process Optimization of Design Phase Based on BIM in China"
"WOS:000329679801271","2013","Research on the Application of BIM in EPC Delivery Model"
"WOS:000353694700054","2013","Semantic Oriented Data Structuration for MABS Application to BIM Short Paper"
"WOS:000318204000010","2013","Best in BIM: The AIA TAP BIM Awards"
"WOS:000329679801199","2013","THE Exploration of BIM Technology Application in The Building Fire Emergency Plan"
"WOS:000318184700009","2013","A GOVERNANCE APPROACH FOR BIM MANAGEMENT ACROSS LIFECYCLE AND SUPPLY CHAINS USING MIXED-MODES OF INFORMATION DELIVERY"
"WOS:000329679800030","2013","The Application of BIM in Architecture Design -Taking ""Step Vision"" of Contest Works for Example"
"WOS:000339411600018","2013","Some Issues of BIM Application in Landscape Architecture"
"WOS:000330191200006","2013","BID Preferentially Activates BAK while BIM Preferentially Activates BAX, Affecting Chemotherapy Response"
"WOS:000319040400004","2013","Structures of cell-wall phosphate-containing glycopolymers of Bifidobacterium longum BIM B-476-D"
"WOS:000217423000011","2013","Analysis of BIM application relationship with integration degree of construction environment"
"WOS:000340643600049","2013","Building Your Own Urban Tool Kit Utilizing parametric BIM components as smart early design tools for large-scale urban planning"
"WOS:000329679801211","2013","Discussing the Influence of BIM for the Construction Project Cost"
"WOS:000331220602252","2013","The BIM deletion polymorphism not associated with treatment efficacy of sorafenib for advanced hepatocellular carcinoma"
"WOS:000331139000136","2013","THE ROLE OF ENDOPLASMIC RETICULUM STRESS IN THE INJURY INDUCED BY BIM OF HYPOXIC CARDIOMYOCYTES"
"WOS:000324041600009","2013","The bHLH proteins BEE and BIM positively modulate the shade avoidance syndrome in Arabidopsis seedlings"
"WOS:000339411600027","2013","The Technique of Computer Simulation Aided Architecture Design in The BIM Environment"
"WOS:000375255605035","2013","Integrating Industry BIM Practices into University Curriculum"
"WOS:000339624905108","2013","RESISTANCE TO BH3 MIMETIC S1 IN NON-SMALL CELL LUNG CANCER CELLS THAT PHOSPHORYLATE BIM THROUGH ERK1/2 AND LEAD TO ITS PROTEASOMAL DEGRADATION"
"WOS:000336106300320","2013","The BIM 'families' based Environmental Performance Design Research"
"WOS:000409595500009","2013","FORMATION OF MORAL AND ECOLOGICAL CULTURE OF THE STUDENTS BY MEANS OF LITERATURE (ON THE EXAMPLE OF THE STORY BY G. TROEPOLSKI ''WHITE BIM BLACK EAR'')"
"WOS:000319824100017","2013","BECN1 and BIM interactions with MCL-1 determine fludarabine resistance in leukemic B cells"
"WOS:000325824100012","2013","FTY720 induces apoptosis of chronic myelogenous leukemia cells via dual activation of BIM and BID and overcomes various types of resistance to tyrosine kinase inhibitors"
"WOS:000349167900018","2013","Secondary Developments Based on BIM Virtual Technology"
"WOS:000321554200006","2013","The roles of epigenetic modifications of proapoptotic BID and BIM genes in imatinib-resistant chronic myeloid leukemia cells"
"WOS:000320906300005","2013","Towards cloud Augmented Reality for construction application by BIM and SNS integration"
"WOS:000332232200001","2013","Enhancing Knowledge Sharing Management Using BIM Technology in Construction"
"WOS:000330320600015","2013","Potentials and Barriers for Implementing BIM in the German AEC Market Results of a current market analysis"
"WOS:000340643600047","2013","Challenges of Integrating BIM in Architectural Education"
"WOS:000340643600051","2013","Experiencing BIM Collaboration in Education"
"WOS:000331139000082","2013","INHIBITION OF AUTOPHAGY INDUCED BY HYPOXIA CONTRIBUTES TO APOPTOSIS VIA UPREGULATING OF BIM AND CASPASE-3 BY DOWNREGULATION OF HIF-1 IN CARDIAC MYOCYTES"
"WOS:000339624902096","2013","EGFR-TKI RESISTANCE DUE TO BIM POLYMORPHISM CAN BE CIRCUMVENTED IN COMBINATION WITH HDAC INHIBITION"
"WOS:000331272900123","2013","PIM-2 REGULATE THE EXPRESSION OF PRO-APOPTOSIS BIM IN CARDIOMYOCYTES WHEN INJURIED BY COLD STRESS"
"WOS:000329441900003","2013","COMBINED 3D BUILDING SURVEYING TECHNIQUES - TERRESTRIAL LASER SCANNING (TLS) AND TOTAL STATION SURVEYING FOR BIM DATA MANAGEMENT PURPOSES"
"WOS:000339463301308","2013","Chooseing suitable BIM software for engineering projects based on the fuzzy neural network evaluation model"
"WOS:000320567900064","2013","Construction of the Information Model of Ancient Architecture Components Based on BIM - A Case Study Of bracket sets"
"WOS:000375256303007","2013","From BIM to Collaboration: A Proposed Integrated Construction curriculum"
"WOS:000325742500024","2013","Generating construction schedules through automatic data extraction using open BIM (building information modeling) technology"
"WOS:000422009300008","2013","HYNEK BIM - A COLLECTION OF SACRED SONGS FROM VNOROVY"
"WOS:000345780300071","2013","Implementation of Prototype for Interoperability between BIM and GIS"
"WOS:000326602500006","2013","Dual inhibition of MEK1/2 and EGFR synergistically induces caspase-3-dependent apoptosis in EGFR inhibitor-resistant lung cancer cells via BIM upregulation"
"WOS:000351496100004","2013","PARAMETERIZE URBAN DESIGN CODES WITH BIM AND OBJECT-ORIENTED PROGRAMMING"
"WOS:000329679801209","2013","The Impact of BIM Application to the Project Organizational Process"
"WOS:000316550900008","2013","Generic Model for Measuring Benefits of BIM as a Learning Tool in Construction Tasks"
"WOS:000331385005289","2013","Multi-Agent Chemotherapy Overcomes Steroid Resistance Conferred by a BIM Deletion Polymorphism in Pediatric Acute Lymphoblastic Leukemia (ALL)"
"WOS:000371647300138","2013","AN ONTOLOGY DRIVEN BIM COMPONENTS REPOSITORY: A NEW WAY TO SHARE BIM COMPONENTS"
"WOS:000329080300431","2013","Exploration On The Application Of Practice Teaching Based On BIM In The Architecture Design"
"WOS:000344994000017","2014","miR-491-5p-induced apoptosis in ovarian carcinoma depends on the direct inhibition of both BCL-X-L and EGFR leading to BIM activation"
"WOS:000421403600030","2014","Integrated management of information inside maintenance processes. From the building registry to BIM systems"
"WOS:000348897704089","2014","Analysis on Application Prospect of BIM Technology in Granary Designing"
"WOS:000340405500002","2014","Developing critical success factors for the assessment of BIM technology adoption: part I. Methodology and survey"
"WOS:000348603600139","2014","What are the Resistances that Hamper the Application of BIM in China?"
"WOS:000380408400016","2014","Toward Automated Spatial Change Analysis of MEP Components using 3D Point Clouds and As-Designed BIM Models"
"WOS:000348897704097","2014","The integration of BIM and the reinforcement information expressions"
"WOS:000210032400002","2014","SEMI-AUTOMATIC GENERATION OF AS-BUILT BIM FACADE GEOMETRY FROM LASER AND IMAGE DATA"
"WOS:000337485500060","2014","Research on Comprehensive Budget Management of Construction Enterprises Supported by BIM Technology"
"WOS:000371314000004","2014","Integration of life cycle assessment in a BIM environment"
"WOS:000337900800093","2014","The disclosure of the BIM concept in civil engineering training"
"WOS:000361385100028","2014","From BIM to VR Integrating immersive visualizations in the current design process"
"WOS:000359377600211","2014","Decrease of peripheral leucocytes BIM protein expression in Crohn's disease"
"WOS:000338985700078","2014","MiR-494 is regulated by ERK1/2 and modulates TRAIL-induced apoptosis in non-small-cell lung cancer through BIM down-regulation (vol 109, pg 16570, 2012)"
"WOS:000345569100083","2014","The Study of the Development Path for BIM between Colleges and Enterprises"
"WOS:000351589700223","2014","A novel MYC directed apoptosis pathway controls NOXA and BIM transcription"
"WOS:000346482000007","2014","Protein kinase C delta protects against bile acid apoptosis by suppressing proapoptotic JNK and BIM pathways in human and rat hepatocytes"
"WOS:000215439600002","2014","Briefing: Towards exploring profession-specific BIM challenges in the UK"
"WOS:000347745800001","2014","Identifying and assessing critical risk factors for BIM projects: Empirical study"
"WOS:000345282400002","2014","Impacts of Isomorphic Pressures on BIM Adoption in Construction Projects"
"WOS:000215238600011","2014","Essential BIM Input Data Study for Housing Refurbishment: Homeowners' Preferences in the UK"
"WOS:000361385100047","2014","The Fusion of BIM and Quadruple Net Value Analysis for Real Estate Development Feasibility Assessment"
"WOS:000341368000001","2014","A Project-based Quantification of BIM Benefits"
"WOS:000342225000005","2014","Status of BIM Adoption and the BIM Experience of Cost Consultants in Australia"
"WOS:000337114400297","2014","Lean Cost Analysis Based on BIM Modeling for Construction Project"
"WOS:000214890600009","2014","Defining the sustainable building design process: methods for BIM execution planning in the UK"
"WOS:000339812700027","2014","Multi-Agent Chemotherapy Overcomes Glucocorticoid Resistance Conferred by a BIM Deletion Polymorphism in Pediatric Acute Lymphoblastic Leukemia"
"WOS:000331155802507","2014","Evaluation of BCL2 and BIM Expression and KRAS Mutations in Lung Adenocarcinoma"
"WOS:000340405500003","2014","Developing critical success factors for the assessment of BIM technology adoption: Part II. Analysis and results"
"WOS:000341370100001","2014","Using BIM to Improve the Design and Construction of Bridge Projects: A Case Study of a Long-span Steel-box Arch Bridge Project (Retracted article. See vol. 12, 96, 2015)"
"WOS:000363251200004","2014","Similar Concepts, Distinct Solutions, Common Problems: Learning from PLM and BIM Deployment"
"WOS:000339456100020","2014","Superimposed mineralization of the Tianbaoshan metallogenic region in Yanbian area (eastern BIM Province), northeastern China: Indicated by the isotopic dating"
"WOS:000329868200026","2014","BH3-Only Protein BIM Mediates Heat Shock-Induced Apoptosis"
"WOS:000335859300078","2014","Integration of Agents in the Construction of a Single-Family House Through use of BIM Technology"
"WOS:000210032400031","2014","A TECHNICAL REVIEW OF BIM BASED COST ESTIMATING IN UK QUANTITY SURVEYING PRACTICE, STANDARDS AND TOOLS"
"WOS:000210032400021","2014","INTEGRATION OF BIM AND GENERATIVE DESIGN TO EXPLOIT AEC CONCEPTUAL DESIGN INNOVATION"
"WOS:000353898900175","2014","Embedded LCA information in BIM models"
"WOS:000349910204173","2014","microRNA-148a is a prognostic oncomiR that targets MIG6 and BIM to regulate EGFR and apoptosis in glioblastoma"
"WOS:000339531800245","2014","Application of BIM technology in green building engineering construction"
"WOS:000398023100028","2014","Is BIM Adoption Advantageous for Construction Industry of Pakistan?"
"WOS:000380551400089","2014","CONVERTING DRAWINGS AND SPECIFICATIONS OF BUILDING STOCK TO BIM MODEL"
"WOS:000336112100006","2014","Productive modeling for development of as-built BIM of existing indoor structures"
"WOS:000358613200083","2014","Evaluation of pro-apoptotic BIM gene loss of function on lapatinib efficacy in patients with metastatic breast cancer (MBC) and in HER2-amplified cell lines"
"WOS:000333716100016","2014","Proteomic Identification of 14-3-3e as a Linker Protein between pERK1/2 Inhibition and BIM Upregulation in Human Osteosarcoma Cells"
"WOS:000342830300008","2014","Framework for Work-Space Planning Using Four-Dimensional BIM in Construction Projects"
"WOS:000349462200128","2014","The Application of BIM Technology and the Three-dimensional Architectural Design"
"WOS:000348117400014","2014","The Research of BIM Theory Applied in Decision Making of Commercial Building Green Retrofit"
"WOS:000344994000018","2014","Impact of conditional deletion of the pro-apoptotic BCL-2 family member BIM in mice"
"WOS:000396731100037","2014","Traditional Design versus BIM Based Design"
"WOS:000361385100046","2014","Applying BIM to Sustainable Performance Evaluation in Design Projects: An Educational Approach for Architecture Programmes"
"WOS:000348897500311","2014","The Application of BIM in the Restoration of Historical buildings"
"WOS:000349780600399","2014","VITAMIN D AGONISTS AND PROTEASOME INHIBITION UPREGULATE BIM PROTEIN IN ENDOTHELIAL CELLS"
"WOS:000336112100007","2014","A BIM centered indoor localization algorithm to support building fire emergency response operations"
"WOS:000334395100026","2014","Use of BIM in the Structural Design of Buildings"
"WOS:000346919804345","2014","BCL-2: BIM RATIOS IN HUMAN PERIPHERAL BLOOD MONONUCLEAR CELL SUBSETS MAY PREDICT SENSITIVITY TO BCL-2 INHIBITION"
"WOS:000341371000001","2014","Application of Cloud Storage on BIM Life-cycle Management"
"WOS:000349910201448","2014","NVP-BEZ235 enhances dexamethasone-induced BIM expression and apoptosis in models of T-ALL with PTEN dysfunction and increased PI3K/AKT activity"
"WOS:000210847100006","2014","Design for maintenance accessibility using BIM tools"
"WOS:000348897500315","2014","Application Exploration of BIM Technology in the Design of Civil Air Defense Projects"
"WOS:000389248204012","2014","LIFECYCLE EVALUATION OF BUILDING SUSTAINABILITY USING BIM AND RTLS"
"WOS:000361385100044","2014","The Truth Is In The Model Utilizing Model Checking to Rate Learning Success in BIM Software Courses"
"WOS:000218635200003","2014","Leveraging the relationship between BIM and asset management"
"WOS:000341783000008","2014","Repression of BIM mediates survival signaling by MYC and AKT in high-risk T-cell acute lymphoblastic leukemia"
"WOS:000349617700242","2014","Discussion of the BIM implementation mode in real estate development companies"
"WOS:000212820000004","2014","A THOUSAND BIM: A rapid value-simulation approach to developing a BIM tool for supporting collaboration during schematic design"
"WOS:000361385100040","2014","A Universal Format for Architectural Program of Requirement A prerequisite for adding architectural programming information to BIM data models"
"WOS:000371314000056","2014","The impact of BIM on risk management as an argument for its implementation in a construction company"
"WOS:000333900000033","2014","The Impact of EGFR T790M Mutations and BIM mRNA Expression on Outcome in Patients with EGFR-Mutant NSCLC Treated with Erlotinib or Chemotherapy in the Randomized Phase III EURTAC Trial"
"WOS:000337642400085","2014","Enhancing Interoperability of Construction Data for Managing Integrated Active BIM Features"
"WOS:000348603600141","2014","Research on the Development Barriers of BIM in China"
"WOS:000344647700025","2014","MYC and EGR1 synergize to trigger tumor cell death by controlling NOXA and BIM transcription upon treatment with the proteasome inhibitor bortezomib"
"WOS:000343296800004","2014","Pro-apoptotic BIM is an essential initiator of physiological endothelial cell death independent of regulation by FOXO3"
"WOS:000214203700008","2014","The Benefits of, and Barriers to, Implementation of 5D BIM for Quantity Surveying in New Zealand"
"WOS:000339463201353","2014","Application of BIM in Project Management"
"WOS:000365049600090","2014","APPLICATION OF BIM TECHNOLOGY ON INTELLIGENT DESIGN IN TRANSITION SECTION"
"WOS:000331502202507","2014","Evaluation of BCL2 and BIM Expression and KRAS Mutations in Lung Adenocarcinoma"
"WOS:000210032400018","2014","VIRTUAL REALITY-BASED CLOUD BIM PLATFORM FOR INTEGRATED AEC PROJECTS"
"WOS:000361385100045","2014","Thinking the BIM Way Early integration of Building Information Modelling in education"
"WOS:000363251200003","2014","Towards a BIM Approach for a High Performance Renovation of Apartment Buildings"
"WOS:000329832700010","2014","Workflow re-engineering of design-build projects using a BIM tool"
"WOS:000344311700011","2014","Corrib onshore gas pipeline, Ireland - using BIM on a large infrastructure project"
"WOS:000344002900005","2014","BIM Cloud Score: Benchmarking BIM Performance"
"WOS:000344321000005","2014","Analysis of BIM (BCL-2 like 11 gene) deletion polymorphism in Chinese non-small cell lung cancer patients"
"WOS:000347745800008","2014","Asynchronous online collaboration in BIM generation using hybrid client-server and P2P network"
"WOS:000333145300013","2014","Clinical Significance of BIM Deletion Polymorphism in Non-Small-Cell Lung Cancer with Epidermal Growth Factor Receptor Mutation"
"WOS:000214346900007","2014","Getting real about BIM Critical realist descriptions as an alternative to the naive framing and multiple fallacies of hype"
