"id","pubyear","title"
"WOS:000378516700007","2016","Integration of BIM and GIS for Formal Representation of Walkability for Safe Routes to School Programs"
"WOS:000376975300100","2016","Research on the Impacts of BIM on Information Exchange between Stakeholders in Construction Project"
"WOS:000385298900036","2016","Developing BIM Culture in a University Past and Future Steps"
"WOS:000404665404013","2016","Relation of the BIM deletion polymorphism to intrinsic EGFR-TKI resistance of Chinese patients with EGFR mutant advanced non-small cell lung cancer"
"WOS:000386718500016","2016","How can BIM support Construction Safety Management? Development of SIM"
"WOS:000384851600007","2016","Implementation of an interoperable process to optimise design and construction phases of a residential building: A BIM Pilot Project"
"WOS:000404459600059","2016","Method of obtaining environmental impact data during the project development process through BIM tool use"
"WOS:000387531600019","2016","Integration of BIM in construction management education: an overview of Pakistani Engineering universities"
"WOS:000400599700003","2016","Future-proofing governance and BIM for owner operators in the UK"
"WOS:000404459600014","2016","An agile process modelling approach for BIM projects"
"WOS:000399115002089","2016","Linked Data View Methodology and Application to BIM Alignment and Interoperability"
"WOS:000369083300013","2016","Modulation of Glucocorticoid Resistance in Pediatric T-cell Acute Lymphoblastic Leukemia by Increasing BIM Expression with the PI3K/mTOR Inhibitor BEZ235"
"WOS:000382353400039","2016","THE APPLICATION OF BIM TECHNOLOGY AND ITS RELIABILITY IN THE STATIC LOAD ANALYSIS"
"WOS:000393315900079","2016","The application and exploration of the foundation construction management in high-rise building based on BIM technology"
"WOS:000393315900036","2016","Research on Building Information Transfer Mode Based on BIM Technology"
"WOS:000390842900003","2016","Kajima's BIM Theory & Methods"
"WOS:000372952300017","2016","An Integrated BIM and cost estimating blended learning model - acceptance differences between experts and novice"
"WOS:000366766800044","2016","Construction safety risk drivers: A BIM approach"
"WOS:000389279901003","2016","Legal Aspects Connected to the Use of BIM in the Danish Building Sector"
"WOS:000388458100185","2016","Application of BIM in Building Electrical Design"
"WOS:000390843800126","2016","Analysis on the CAD and BIM Techniques and the Applications on Construction Engineering under the Collaborative Research Background and Evolution"
"WOS:000391590900064","2016","Evaluation of maturity of BIM tools across different software platforms"
"WOS:000392751900064","2016","Best Practice to realize applications for the virtual and interactive fruition of architectural and archeological structural BIM models and design objects"
"WOS:000385266900079","2016","The Promotion Channel Investigation of BIM Technology Application"
"WOS:000390409300009","2016","A Study of Applying BIM Technique into Fire Disaster Investigation System"
"WOS:000382341200001","2016","Towards 3D-enabled urban land administration: Strategic lessons from the BIM initiative in Singapore"
"WOS:000404459600026","2016","Generation of serious games environments from BIM for a virtual reality crisis-management system"
"WOS:000387531600159","2016","Utilizing BIM and Carbon Estimating Methods for Meaningful Data Representation"
"WOS:000393210100005","2016","Towards increased BIM usage for existing building interventions"
"WOS:000387502700091","2016","The Implementation of Geotechnical Data Into the BIM Process"
"WOS:000404459600077","2016","Managing constructability on a construction stage: BIM methods"
"WOS:000396453500006","2016","A KNOWLEDGE REPRESENTATION APPROACH IN BIM RULE REQUIREMENT ANALYSIS USING THE CONCEPTUAL GRAPH"
"WOS:000371841100044","2016","An investigation of the impact of building orientation on energy consumption in a domestic building using emerging BIM (Building Information Modelling)"
"WOS:000389279905016","2016","A Wireless Tracking System Integrated with BIM for Indoor Construction Applications"
"WOS:000388288800088","2016","Analysis on the innovation and impact of BIM technology in the field of engineering cost"
"WOS:000404459600043","2016","Collaboration requirements and interoperability fundamentals in BIM based multi-disciplinary building design processes"
"WOS:000384707800003","2016","Application of MCDM and BIM for Evaluation of Asset Redevelopment Solutions"
"WOS:000388365500092","2016","Research on BIM implementation plan in construction enterprise"
"WOS:000404459600021","2016","A versatile and extensible solution to the integration of BIM and energy simulation"
"WOS:000384639400438","2016","Research on the project management of BIM project from the perspective of enterprise strategy"
"WOS:000391718500028","2016","Research on the Application of BIM in Sewage Treatment Project"
"WOS:000384838900004","2016","SURVEYING THE EXTENT AND USE OF 4D BIM IN THE UK"
"WOS:000385266900059","2016","Application of BIM for Safety Management During Construction"
"WOS:000391590900039","2016","Enhancing Facility Management through BIM 6D"
"WOS:000393210500004","2016","Practical challenges of BIM education"
"WOS:000392747900070","2016","INTEGRATION OF GIS AND BIM FOR INDOOR GEOVISUAL ANALYTICS"
"WOS:000378549400015","2016","Investigating the Potential of Delivering Employer Information Requirements in BIM Enabled Construction Projects in Qatar"
"WOS:000380598400004","2016","How to tell if a BIM project is successful: A goal-driven approach"
"WOS:000416328600018","2016","The use of BIM technology in teaching related to Architecture. cooperative and collaborative learning based on real projects between different subjects"
"WOS:000390059500157","2016","COLLINEAR FORCE AND FREQUENCY ANALYSIS OF A VIADUCT PILE FOUNDATION CONSTRUCTION PROJECT: A CASE STUDY ON THE APPLICATION OF BIM TECHNOLOGY"
"WOS:000376694600007","2016","Ontology-based semantic approach for construction-oriented quantity take-off from BIM models in the light-frame building industry"
"WOS:000393315900063","2016","The creation and exploration of Revit family based on BIM technology"
"WOS:000377239100017","2016","SECOND CONFERENCE OF INTELIKA BIM (TO)DAY"
"WOS:000377595900087","2016","Association between BIM deletion polymorphism and the risk of non-small cell lung cancer in Chinese"
"WOS:000386361800010","2016","Comparative Analysis on the Adoption and Use of BIM in Road Infrastructure Projects"
"WOS:000392471800035","2016","Developing Managerial and Digital Competencies Trough BIM Technologies in Construction Industry"
"WOS:000385790700047","2016","ENHANCE ARCHITECTURAL HERITAGE CONSERVATION USING BIM TECHNOLOGY"
"WOS:000372809000012","2016","Near-Miss Information Visualization Tool in BIM for Construction Safety"
"WOS:000383912700034","2016","Cooperation Issue in BIM Application in China and Its Solution"
"WOS:000386326000045","2016","Research on barriers analysis of formwork and BIM solution"
"WOS:000386114400004","2016","Precast workflow productivity measurement through BIM adoption"
"WOS:000390717900003","2016","Exploring the value of BIM for corporate real estate"
"WOS:000389279904021","2016","Automated Recognition of Unlabeled Items in BIM Models"
"WOS:000366650000007","2016","Framework for Evaluating the BIM Competencies of Facility Owners"
"WOS:000383946300132","2016","Information management in the application of BIM in construction. The roles and functions of the participants of the construction process"
"WOS:000391181200003","2016","Switching to nilotinib in patients with chronic myeloid leukemia in chronic phase with molecular suboptimal response to frontline imatinib: SENSOR final results and BIM polymorphism substudy"
"WOS:000369548800009","2016","Paxillin confers resistance to tyrosine kinase inhibitors in EGFR-mutant lung cancers via modulating BIM and Mcl-1 protein stability"
"WOS:000391590900067","2016","Integrating BIM and Web Map Service (WMS) for Green Building Certification"
"WOS:000404459600051","2016","Methodology for tracking BIM benefits on project level"
"WOS:000402064400065","2016","Tracking Changes in Buildings over Time Fully Automated Reconstruction and Difference Detection of 3d Scan and BIM files"
"WOS:000378862000013","2016","Cloud-Based BIM Governance Platform Requirements and Specifications: Software Engineering Approach Using BPMN and UML"
"WOS:000405269000090","2016","Optimize bridge construction process based on BIM technology"
"WOS:000385790700045","2016","SMART BIM OBJECT FOR DESIGN INTELLIGENCE"
"WOS:000390695300004","2016","Developing a tailored RBS linking to BIM for risk management of bridge projects"
"WOS:000391590900075","2016","The effects of BIM and lean construction on design management practices"
"WOS:000385790000130","2016","THE SINGLE FACTOR INFLUENCE MODEL AND BIM FUSION TECHNOLOGY RESEARCH OF CONSTRUCTION PROGRESS"
"WOS:000389279905003","2016","Role of BIM and 3D Laser Scanning on Job Sites from the Perspective of Construction Project Management Personnel"
"WOS:000377756800074","2016","The role of VDR and BIM in potentiation of cytarabine-induced cell death in human AML blasts"
"WOS:000389800900005","2016","A Framework for Improving Collaboration Patterns in BIM Projects"
"WOS:000373334000215","2016","The Analysis and Application of BIM Technology in Design of Steel Structure Joints"
"WOS:000404459600068","2016","Combining BIM models and data with game technology to improve the decision making process: 'PlayConstruct'"
"WOS:000389377400018","2016","Key Factors Affecting BIM Adoption in China Based on TOE&RC"
"WOS:000386718500040","2016","A Review of BIM Capabilities for Quantity Surveying Practice"
"WOS:000386718500050","2016","A CMMS Expert using BIM for IBS Building Maintenance"
"WOS:000383150200022","2016","TDVRP and BIM Integrated Approach for In- Building Emergency Rescue Routing"
"WOS:000386718500058","2016","The Rise Of BIM in Malaysia And Its Impact Towards Quantity Surveying Practices"
"WOS:000413351900006","2016","Hybrid project delivery processes observed in constructor BIM innovation adoption"
"WOS:000379181200003","2016","A framework for 3D traffic noise mapping using data from BIM and GIS integration"
"WOS:000389805700020","2016","Mixed Method Assessment for BIM Implementation in the AEC Curriculum"
"WOS:000402064400063","2016","Developing a Tangible User Interface for Parametric and BIM Applications Using Physical Computing Systems"
"WOS:000371554000001","2016","Modularized rule-based validation of a BIM model pertaining to model views"
"WOS:000387531600195","2016","Using BIM to Retrofit Existing Buildings"
"WOS:000387731800055","2016","Application of the BIM Technology in the HVAC Design for an Office Building in Nanjing"
"WOS:000389279904048","2016","Optimizing the Selection and Layout of Table Forms with Different Dimensions Using BIM and Integer Programming"
"WOS:000387531600033","2016","Optimizing BIM metadata manipulation using parametric tools"
"WOS:000376028000008","2016","GREEN BIM CONCEPT-SCANDINA VIAN INSPIRATIONS"
"WOS:000383616901524","2016","Linear low molecular weight alpha-1,6-glucan from Bifidobacterium bifidum BIM B-733D is implicated in pathogenesis of celiac disease"
"WOS:000389279904043","2016","Improvement of Facility Condition Assessment Processes Using BIM Data"
"WOS:000402984700062","2016","Light Pollution and BIM Application"
"WOS:000388800200005","2016","Lightweighting for Web3D visualization of large-scale BIM scenes in real-time"
"WOS:000381411000006","2016","Adoption of BIM by architectural firms in India: technology-organization-environment perspective"
"WOS:000371688200010","2016","Comparative Study of BIM Acceptance between Korea and the United States"
"WOS:000390695300005","2016","Bridging the gap: bringing BIM to construction workers"
"WOS:000378863600007","2016","Case Study of BIM and Cloud-Enabled Real-Time RFID Indoor Localization for Construction Management Applications"
"WOS:000380000500009","2016","An Analysis of BIM Web Service Requirements and Design to Support Energy Efficient Building Lifecycle"
"WOS:000390886600001","2016","Design for safety: theoretical framework of the safety aspect of BIM system to determine the safety index"
"WOS:000392785700060","2016","Process Framework of Information Modeling for BIM Execution Planning"
"WOS:000374868100005","2016","Preparation of Synthetic As-Damaged Models for Post-Earthquake BIM Reconstruction Research"
"WOS:000385790700048","2016","DEVELOPMENT OF THE INTEGRATED MANAGEMENT ENVIRONMENT OF BIM PROPERTY FOR BIM-BASED SUSTAINABLE DESIGN"
"WOS:000386718500003","2016","The Issues and Considerations Associated with BIM Integration"
"WOS:000380374500006","2016","DEVELOPING CONSTRUCTION DEFECT MANAGEMENT SYSTEM USING BIM TECHNOLOGY IN QUALITY INSPECTION"
"WOS:000386357000014","2016","Development of a Multifunctional BIM Maturity Model"
"WOS:000387596200007","2016","Association of BIM Deletion Polymorphism and BIM-gamma RNA Expression in NSCLC with EGFR Mutation"
"WOS:000384851600008","2016","Towards the BIM implementation for historical building restoration sites"
"WOS:000382793700005","2016","Towards generation of as-damaged BIM models using laser-scanning and as-built BIM: First estimate of as-damaged locations of reinforced concrete frame members in masonry infill structures"
"WOS:000397931600016","2016","Case Study of Construction Cost Estimation in China Electric Power Industry Based on BIM Technology"
"WOS:000384838900006","2016","CULTURE CHANGE IN CONSTRUCTION INDUSTRY: FROM 2D TOWARD BIM BASED CONSTRUCTION"
"WOS:000379371100010","2016","A linked data system framework for sharing construction defect information using ontologies and BIM environments"
"WOS:000404459600003","2016","What's in a model? Intelligent semantic enrichment of BIM models"
"WOS:000387531600105","2016","Comparing Building Information Modeling Skills of Project Managers and BIM Managers based on Social Media Analysis"
"WOS:000386619700010","2016","Application Study of Green Building Energy Consumption Analysis Based on BIM Technology"
"WOS:000383703600025","2016","Association of BIM Deletion Polymorphism With Intrinsic Resistance to EGFR Tyrosine Kinase Inhibitors in Patients With Lung Adenocarcinoma"
"WOS:000377675100007","2016","Development of BIM Execution Plan for BIM Model Management during the Pre-Operation Phase: A Case Study"
"WOS:000405512400101","2016","A BIM and Ontology-based Intelligent Application Framework"
"WOS:000385979400002","2016","Primary BIM dataset for refurbishing flood risk vulnerable housing in the UK"
"WOS:000404459600078","2016","Integrating BIM and agent-based modelling for construction operational optimization-a LBS approach"
"WOS:000404459600019","2016","Facilitating the BIM coordinator and empowering the suppliers with automated data compliance checking"
"WOS:000375699000003","2016","Ruxolitinib synergizes with DMF to kill via BIM plus BAD-induced mitochondrial dysfunction and via reduced SOD2/TRX expression and ROS"
"WOS:000370524700002","2016","The apoptotic effect of simvastatin via the upregulation of BIM in nonsmall cell lung cancer cells"
"WOS:000391590900073","2016","The Integration of BIM in Later Project Life Cycle Phases in Unprepared Environment from FM perspective"
"WOS:000384107700008","2016","RAG-induced DNA lesions activate proapoptotic BIM to suppress lymphomagenesis in p53-deficient mice"
"WOS:000381529400037","2016","Cost-effective energy saving measures based on BIM technology: Case study at National Taiwan University"
"WOS:000371690400022","2016","Leveraging BIM to Provide Automated Support for Efficient Troubleshooting of HVAC-Related Problems"
"WOS:000376441400010","2016","Survey: Common Knowledge in BIM for Facility Maintenance"
"WOS:000371186800019","2016","Planning Intensive interwoven Joints Digital integrated Planning and BIM optimized Building Measures"
"WOS:000391718500042","2016","Schedule Management in Underground Municipal Pipe Network Construction Based on BIM Technology"
"WOS:000376698600021","2016","Construction risk knowledge management in BIM using ontology and semantic web technology"
"WOS:000402064400066","2016","Toward Space Oriented BIM Practices"
"WOS:000404459600065","2016","A review of resource based view in the construction industry: A BIM case as a strategic resource"
"WOS:000390843800125","2016","Research on Developmental Trend of BIM Technology of Construction Project under Big Data and Internet Background"
"WOS:000377706300019","2016","Virtual Plan-Design-Build for Capstone Projects in the School of Architecture: CM & BIM Studios in Five-Year B.Arch. Program"
"WOS:000387531600075","2016","Experiential and project-based learning in BIM for sustainable living with tiny solar houses"
"WOS:000378549400018","2016","Comparing BIM in Construction with 3D Modeling in Shipbuilding Industries: Is the Grass Greener on the Other Side?"
"WOS:000376794400003","2016","DEVELOPING AS-BUILT BIM MODEL PROCESS MANAGEMENT SYSTEM FOR GENERAL CONTRACTORS: A CASE STUDY"
"WOS:000383266600072","2016","Application Research of BIM Technology in Computer Aided Design of Building Foundation"
"WOS:000402064400059","2016","Automated Generation of BIM Models"
"WOS:000374760100006","2016","An Example of BIM Integrated into Architectural Curriculum"
"WOS:000386718500092","2016","Holistic BIM Adoption and Diffusion in Malaysia"
"WOS:000381013100007","2016","Targeting glutamine metabolism in multiple myeloma enhances BIM binding to BCL-2 eliciting synthetic lethality to venetoclax"
"WOS:000404459600016","2016","Seamless integration of common data environment access into BIM authoring applications: The BIM integration framework"
"WOS:000377675100006","2016","Exploring the Relationship between Research and BIM Standardization: A Systematic Mapping of Early Studies on the IFC Standard (1997-2007)"
"WOS:000378862000024","2016","Slim BIM Charts for Rapidly Visualizing and Quantifying Levels of BIM Adoption and Implementation"
"WOS:000387531600084","2016","Achieving sustainable structural steel design by estimating fabrication labor cost based on BIM data"
"WOS:000389617000026","2016","Interaction between Lean Construction and the working method BIM using the example of application of visualization and modelling of the construction process"
"WOS:000389279900008","2016","Framework Development to Introduce BIM into the Civil Engineering Undergraduate Curriculum at the University of Puerto Rico, Mayaguez Campus"
"WOS:000369951800043","2016","The BIM deletion polymorphism: A paradigm of a permissive interaction between germline and acquired TKI resistance factors in chronic myeloid leukemia"
"WOS:000389940601263","2016","Novel biomarkers for VEGFR inhibitors in metastatic renal cell carcinoma: BIM expression, and germline polymorphisms of BIM and PIK3R1"
"WOS:000392593700023","2016","REVIEWING THE USEFULNESS OF BIM ADOPTION IN IMPROVING SAFETY ENVIRONMENT OF CONSTRUCTION PROJECTS"
"WOS:000383946300133","2016","Information management in the application of BIM in construction. Stages of construction"
"WOS:000385253500036","2016","Enabling Secure and Collaborative Document Sharing in BIM Processes"
"WOS:000386131600010","2016","Analysis of Uncertainty in a Middle-Cost Device for 3D Measurements in BIM Perspective"
"WOS:000404459600063","2016","Using BIM to support simulation of compliant building evacuation"
"WOS:000384838900015","2016","PEDAGOGY AND ASSESSMENT OF STUDENT LEARNING IN BIM AND SUSTAINABLE DESIGN AND CONSTRUCTION"
"WOS:000374581900101","2016","Research on the Integration of Lean Construction and BIM and a Case Study in Shanghai Tower Project"
"WOS:000382460500013","2016","Real-time PCR assay with high resolution melting for EGFR and BIM mutation of lung cancer"
"WOS:000384838900010","2016","COLLABORATION AND COORDINATION LEARNING MODULES FOR BIM EDUCATION"
"WOS:000384126800012","2016","Middleware for Translating Urban GIS Information for Building a Design Society Via General BIM Tools"
"WOS:000386371100018","2016","Interpreted Information Exchange: Systematic Approach for BIM to Engineering Analysis Information Transformations"
"WOS:000386458100006","2016","The interdependences of BIM and supply chain partnering: empirical explorations"
"WOS:000384838900014","2016","LASER SCANNING TECHNOLOGY AND BIM IN CONSTRUCTION MANAGEMENT EDUCATION"
"WOS:000396318300127","2017","The HDAC inhibitor SB939 overcomes resistance to BCR-ABL kinase Inhibitors conferred by the BIM deletion polymorphism in chronic myeloid leukemia"
"WOS:000397237300002","2017","The application and barriers of BIM in sustainable building design"
"WOS:000412959600043","2017","The promise of BIM for improving building performance"
"WOS:000400227200074","2017","Application of nD BIM Integrated Knowledge-based Building Management System (BIM-IKBMS) for inspecting post-construction energy efficiency"
"WOS:000399729200001","2017","Case Study of Carbon Emissions from a Building's Life Cycle Based on BIM and Ecotect (Retraction of Vol 2015, art no 954651, 2015)"
"WOS:000405993100331","2017","A study of effective application of BIM technology in green building"
"WOS:000400983700015","2017","Digital Planning and Building: Open BIM or Closed BIM?"
"WOS:000407448800011","2017","Improving conventional method on precast concrete building maintenance Towards BIM implementation"
"WOS:000418450200040","2017","Study on the Application of BIM Energy Analysis Technology in Architectural Design"
"WOS:000405993200186","2017","Research on Automatic Generation of BIM Schedule Based on Genetic Algorithm"
"WOS:000407337700009","2017","Empirical Study of BIM Implementation-Based Perceptions among Chinese Practitioners"
"WOS:000404873600053","2017","Sustainability assessment through green BIM for environmental, social and economic efficiency"
"WOS:000394013000001","2017","An Advanced Process of Condensation Performance Evaluation by BIM Application"
"WOS:000409249800014","2017","Leveraging BIM for digital built environment asset management"
"WOS:000413055802494","2017","Sequence of EGFR-TKI Therapy and BIM Deletion Polymorphism Affect the Outcome of Treatment in EGFR Positive NSCLC"
"WOS:000416690100005","2017","Modelling paths of risks associated with BIM implementation in architectural, engineering and construction projects"
"WOS:000413305000006","2017","A cost-plus estimating framework for BIM related design and engineering services"
"WOS:000415706200006","2017","The adoption of 4D BIM in the UK construction industry: an innovation diffusion approach"
"WOS:000417428700110","2017","Utilization of BIM for automation of quantity takeoffs and cost estimation in transport infrastructure construction projects in the Czech Republic"
"WOS:000392044800005","2017","BIMTag: Concept-based automatic semantic annotation of online BIM product resources"
"WOS:000414664000007","2017","Leveraging BIM and Big Data to deliver well maintained highways"
"WOS:000410919400110","2017","Assessment of buildings redevelopment possibilities using MCDM and BIM techniques"
"WOS:000413607600031","2017","A simplified relational database schema for transformation of BIM data into a query-efficient and spatially enabled database"
"WOS:000406409900061","2017","Silvertown Tunnel, London, England-A Case Study Applying BIM Principles to the Geotechnical Process"
"WOS:000413957500001","2017","Challenges when implementing BIM for industry change"
"WOS:000418868000017","2017","Implementation of BIM in the Subject Technical Industrial Projects-Degree in Industrial Technologies Engineering-University of Valladolid"
"WOS:000416965000119","2017","Root Causes Occurrence of Low BIM Adoption in Malaysia: System Dynamics Modelling Approach"
"WOS:000406779600033","2017","Integrating BIM and new rules of measurement for embodied energy and CO2 assessment"
"WOS:000399894800011","2017","Management of Collaborative BIM Data by Federating Distributed BIM Models"
"WOS:000405314300034","2017","Research on the Application of BIM Technology in Tunnel Project Construction"
"WOS:000418658300013","2017","Integration of BIM and LCA: Evaluating the environmental impacts of building materials at an early stage of designing a typical office building"
"WOS:000403778000005","2017","A LITERATURE REVIEW OF THE FACTORS LIMITING THE APPLICATION OF BIM IN THE CONSTRUCTION INDUSTRY"
"WOS:000404607800075","2017","The Application of BIM Technology in Building Construction Quality Management and Talent Training"
"WOS:000418465300140","2017","Ontology of BIM in a Construction Project Life Cycle"
"WOS:000415706200028","2017","Framework for productivity and safety enhancement system using BIM in Singapore"
"WOS:000405992300086","2017","Virtual construction method and application of building construction process based on BIM technology"
"WOS:000416378300231","2017","APPLICATION OF BIM TECHNOLOGY IN DESIGN AND CONSTRUCTION: A CASE STUDY OF PHARMACEUTICAL INDUSTRIAL BASE OF AMINO ACID BUILDING PROJECT"
"WOS:000409249800015","2017","The INNOVance BIM library approach"
"WOS:000406399800061","2017","FROM OSS CAD TO BIM FOR CULTURAL HERITAGE DIGITAL REPRESENTATION"
"WOS:000410891200005","2017","A Framework for Using Point Cloud Data of Heritage Buildings Toward Geometry Modeling in A BIM Context: A Case Study on Santa Maria La Real De Mave Church"
"WOS:000417848800001","2017","Bilateral comparison of 1 ohm and 10 k ohm standards (ongoing BIPM key comparisons BIPM.EM-K13.a and 13.b) between the BIM (Bulgaria) and the BIPM"
"WOS:000405314300089","2017","An Investigation of the Latent Barriers to BIM Adoption and Development"
